{
  "$schema": "../../spec/calendar.schema.json",
  "id": "de-hb",
  "extends": "de",
  "name": {
    "en": "Germany — Bremen",
    "de": "Deutschland — Bremen"
  },
  "holidays": [
    {
      "id": "reformation_day",
      "name": {
        "en": "Reformation Day",
        "de": "Reformationstag"
      },
      "rule": {
        "type": "fixed",
        "month": 10,
        "day": 31
      },
      "since": 2018
    }
  ],
  "sources": [
    {
      "title": "Brem.GBl. 2018 Nr. 63 S. 302 (Reformationstag)",
      "url": "https://www.gesetzblatt.bremen.de/fastmedia/218/2018_06_28_GBl_Nr_0063_signed.pdf"
    }
  ]
}
