{
  "$schema": "../../spec/calendar.schema.json",
  "id": "de-rp",
  "extends": "de",
  "name": {
    "en": "Germany — Rhineland-Palatinate (Rheinland-Pfalz)",
    "de": "Deutschland — Rheinland-Pfalz"
  },
  "holidays": [
    {
      "id": "corpus_christi",
      "name": {
        "en": "Corpus Christi",
        "de": "Fronleichnam"
      },
      "rule": {
        "type": "easter",
        "offset": 60
      }
    },
    {
      "id": "all_saints",
      "name": {
        "en": "All Saints' Day",
        "de": "Allerheiligen"
      },
      "rule": {
        "type": "fixed",
        "month": 11,
        "day": 1
      }
    }
  ]
}
