{
  "$schema": "../../spec/calendar.schema.json",
  "id": "de-be",
  "extends": "de",
  "name": {
    "en": "Germany — Berlin",
    "de": "Deutschland — Berlin"
  },
  "holidays": [
    {
      "id": "womens_day",
      "name": {
        "en": "International Women's Day",
        "de": "Internationaler Frauentag"
      },
      "rule": {
        "type": "fixed",
        "month": 3,
        "day": 8
      },
      "since": 2019
    }
  ],
  "one_off": [
    {
      "id": "liberation_day",
      "name": {
        "en": "75th anniversary of the end of the Second World War",
        "de": "Tag der Befreiung"
      },
      "date": "2020-05-08"
    },
    {
      "id": "liberation_day",
      "name": {
        "en": "80th anniversary of the end of the Second World War",
        "de": "Tag der Befreiung"
      },
      "date": "2025-05-08"
    },
    {
      "id": "uprising_anniversary",
      "name": {
        "en": "75th anniversary of the 1953 uprising",
        "de": "75. Jahrestag des Volksaufstands vom 17. Juni 1953"
      },
      "date": "2028-06-17"
    }
  ],
  "sources": [
    {
      "title": "Berlin: einmaliger Feiertag am 8. Mai 2025",
      "url": "https://www.berlin.de/aktuelles/9188766-958090-einmaliger-feiertag-am-8-mai-2025.html"
    }
  ]
}
